### ISSUE TITLE
Using the script for my IP-Camera: .jpg is working fine but .mp4 doesnt ?

### ISSUE THREAD

**Issue by bbfendt** [schinken/ftp2telegram#5]
Hello from me once again :)
Thanks once more for the quick solving of my last issue !
This one is a bit more complex to describe so i hope you dont mind i will do it in German:

**Ausgangslage:**

- Ich will deine Anwendung dazu verwenden um von meinen IP-Kameras per FTP-Upload die Bilder (.jpg) und Videoclips (.mp4) nach Telegram zu pushen
- Dank deinem Hinweis im letzten Issue habe ich mittlerweile den Raspberry so weit, daß er wenn ich per WinSCP eine .jpg-Datei auf den FTP uploade er diese in die Telegram-Gruppe pusht. Bei .MP4-Videos, die ich von der Kamera manuell downloade geht das ebenfalls
- Ich habe daraufhin die Kamera direkt an den FTP angebunden. Die JPG-Schnappschüsse haben dann auch sofort funktioniert.

**Problem:**

Bei den Videos funktioniert das Ganze bisher leider noch nicht.
Wenn ich einen Event in der Kamera auslöse und ein Video übertragen wird bekomme ich in der shell am Raspberry folgende Meldung:

_

> Server is running
> [bot.info] bot started
> {"name":"ftp-srv","hostname":"Testkamera","pid":6844,"id":"ccc2b2a7-d880-4806                                                                                                                                                                                   -bc14-bbc91e6a257b","ip":"192.168.178.62","directive":"SIZE","level":50,"err":{"                                                                                                                                                                                   message":"File not found","name":"Error","stack":"Error: File not found\n    at                                                                                                                                                                                    MemoryFileSystem.get (/root/ftp2telegram/lib/MemoryFileSystem.js:64:19)\n    at                                                                                                                                                                                    /root/ftp2telegram/node_modules/ftp-srv/src/commands/registration/size.js:9:38\n                                                                                                                                                                                       at tryCatcher (/root/ftp2telegram/node_modules/bluebird/js/release/util.js:1                                                                                                                                                                                   6:23)\n    at Promise.attempt.Promise.try (/root/ftp2telegram/node_modules/blueb                                                                                                                                                                                   ird/js/release/method.js:39:29)\n    at FtpConnection.handler (/root/ftp2telegra                                                                                                                                                                                   m/node_modules/ftp-srv/src/commands/registration/size.js:9:23)\n    at FtpComman                                                                                                                                                                                   ds.handle (/root/ftp2telegram/node_modules/ftp-srv/src/commands/index.js:70:28)\                                                                                                                                                                                   n    at /root/ftp2telegram/node_modules/ftp-srv/src/connection.js:47:67\n    at                                                                                                                                                                                    tryCatcher (/root/ftp2telegram/node_modules/bluebird/js/release/util.js:16:23)\n                                                                                                                                                                                       at Object.gotValue (/root/ftp2telegram/node_modules/bluebird/js/release/redu                                                                                                                                                                                   ce.js:166:18)\n    at Object.gotAccum (/root/ftp2telegram/node_modules/bluebird/                                                                                                                                                                                   js/release/reduce.js:155:25)\n    at Object.tryCatcher (/root/ftp2telegram/node_                                                                                                                                                                                   modules/bluebird/js/release/util.js:16:23)\n    at Promise._settlePromiseFromHan                                                                                                                                                                                   dler (/root/ftp2telegram/node_modules/bluebird/js/release/promise.js:547:31)\n                                                                                                                                                                                       at Promise._settlePromise (/root/ftp2telegram/node_modules/bluebird/js/release                                                                                                                                                                                   /promise.js:604:18)\n    at Promise._settlePromiseCtx (/root/ftp2telegram/node_m                                                                                                                                                                                   odules/bluebird/js/release/promise.js:641:10)\n    at _drainQueueStep (/root/ftp                                                                                                                                                                                   2telegram/node_modules/bluebird/js/release/async.js:97:12)\n    at _drainQueue (                                                                                                                                                                                   /root/ftp2telegram/node_modules/bluebird/js/release/async.js:86:9)"},"msg":"File                                                                                                                                                                                    not found","time":"2022-05-01T14:28:56.040Z","v":0}

_

Mein Verdacht ist, daß die Datei aus dem virtuellen Dateisystem zu schnell gelöscht wird ?
Ich kann ausschließen, daß es am Videoformat oder am Dateinamen (enthält Sonderzeichen "[, @,]") liegt, da das Script funktioniert wenn ich das Video manuell von der Kamera hole und per WinSCP auf den FTP lade. Ich hatte auch an die Pfadlänge gedacht, da die Kamera eine sehr komplexe Pfadsruktur auf dem FTP anlegt (./Kameraname/JJJJ-MM-TT/001/dav/HH/Dateiname.mp4) aber bei den Bilder ist es eine ähnliche wenn auch kürzere Pfadstruktur (./Kameraname/JJJJ-MM-TT/001/jpg/HH/MM/Bildname.jpg) und dein Script macht da keine Probleme.

Ich habe bereits einen Wireshark-Mitschnitt erstellt und kann daher sicher sagen, daß die Videodatei auch wirklich auf den FTP übertragen wird. Die Dateigröße der Videos war bei den Tests zwischen 2Mb und 6Mb. 
Einen Wireshark-Mitschnitt könnte ich bei Bedarf liefern - hier ein kleiner Auszug der Zeigt wie die Datei übertagen wird:

Protocol | Length | Info
-- | -- | --
FTP | 159 | Request: stor   /KatzencamIV/2022-05-01/001/dav/16/16.43.41-16.43.41[M][0@0][0].mp4_
TCP | 84 | 21 → 41539 [ACK] Seq=274 Ack=215 Win=65280 Len=0 TSval=2709245612   TSecr=3787362
FTP | 137 | Response: 150 File status okay; about to open data connection
FTP-DATA | 124 | FTP Data: 40 bytes (PASV) (stor   /KatzencamIV/2022-05-01/001/dav/16/16.43.41-16.43.41[M][0@0][0].mp4_)
TCP | 84 | 21009 → 48550 [ACK] Seq=1 Ack=41 Win=65152 Len=0 TSval=2709245625   TSecr=3787364
FTP | 90 | Request: PASV
FTP | 120 | Response: 227 PASV OK (192,168,178,52,82,18)
TCP | 84 | 41540 → 21 [ACK] Seq=140 Ack=274 Win=29200 Len=0 TSval=3787365   TSecr=2709245631
TCP | 92 | 44089 → 21010 [SYN] Seq=0 Win=29200 Len=0 MSS=1460 SACK_PERM=1   TSval=3787365 TSecr=0 WS=16
TCP | 92 | 21010 → 44089 [SYN, ACK] Seq=0 Ack=1 Win=65160 Len=0 MSS=1460 SACK_PERM=1   TSval=2709245637 TSecr=3787365 WS=128
TCP | 84 | 21010 → 44089 [ACK] Seq=1 Ack=13 Win=65152 Len=0 TSval=2709245653   TSecr=3787366
FTP-DATA | 1532 | FTP Data: 1448 bytes (PASV) (stor   /KatzencamIV/2022-05-01/001/dav/16/16.43.41-16.43.41[M][0@0][0].mp4_)
FTP-DATA | 1532 | FTP Data: 1448 bytes (PASV) (stor   /KatzencamIV/2022-05-01/001/dav/16/16.43.41-16.43.41[M][0@0][0].mp4_)
TCP | 84 | 21009 → 48550 [ACK] Seq=1 Ack=1489 Win=64128 Len=0 TSval=2709245906   TSecr=3787391
TCP | 84 | 21009 → 48550 [ACK] Seq=1 Ack=2937 Win=64128 Len=0 TSval=2709245907   TSecr=3787391

Hättest du eine Idee warum das nicht klappt bzw. wie ich weiter debuggen könnte ?
Vielen Dank im Vorraus und Gruß,

bbfendt

**Comment by schinken** [comment]
Ich schaus mir morgen mal an... es kann auch sein, dass der codec vllt net passt. hast du evtl n sample? kannst auch gerne an mail@schinken.io schicken wenn dus hier net hochladen willst

**Comment by schinken** [comment]
Kannst du aus spass mal ne stelle ändern?

https://github.com/schinken/ftp2telegram/blob/fa7ac8f0792bdc288e84f700af38019a2da61bac/lib/TelegramProxy.js#L14

`const buffer =  new Buffer(stream.toString());`

Weil egtl dachte ich, erstellt das toBuffer eine kopie... wenns das nicht tut, dann kanns sein, dass das auftritt was du meinst

**Comment by schinken** [comment]
Ich glaube ja fast eher, dass du da hinfliegst:

https://github.com/schinken/ftp2telegram/blob/master/lib/MemoryFileSystem.js#L64

Weil deine kamera irgend n file versucht zu GETen, dass es nicht gibt.

**Comment by bbfendt** [comment]
Fixed by schinken - thank you so much !
Great tool to use for IP-Cam 2 Telegram.
